Column,Era,author,filename,title,,url,123,Medieval,Fredegarius Scholasticus,fredegarius.txt,Chronicon,Fredegarius Scholasticus,http://thelatinlibrary.com/fredegarius.html,87,Medieval,[Flavius Valerius Aurelius Constantinus Augustus],donation.txt,Donatio Constantini,,http://thelatinlibrary.com/donation.html,951,Classical,[Gaius Iulius Caesar],alex.txt,De Bello Alexandrino Liber,Pseudo-Caesar,http://thelatinlibrary.com/caesar/alex.shtml,955,Classical,[Gaius Iulius Caesar],bellafr.txt,DE BELLO AFRICO LIBER,Pseudo-Caesar,http://thelatinlibrary.com/caesar/bellafr.shtml,964,Classical,[Gaius Iulius Caesar],hisp.txt,DE BELLO HISPANIENSI LIBER,Pseudo-Caesar,http://thelatinlibrary.com/caesar/hisp.shtml,2,Medieval,Abbo Floriacensis,abbofloracensis.txt,Passio Sancti Edmundi Regis Et Martyris,Saint Abbo of Fleury,http://thelatinlibrary.com/abbofloracensis.html,3,Medieval,Adso Dervensis,adso.txt,De Ortu Et Tempore Antichristi,Adso of Montier-en-Der,http://thelatinlibrary.com/adso.html,86,Classical,Aelius Donatus,don.txt,DE PARTIBUS ORATIONIS ARS MINOR,Aelius Donatus,http://thelatinlibrary.com/don.html,4,Medieval,Aelredus Rievallensis,aelredus.txt,De Amicitia,Aelred of Rievaulx,http://thelatinlibrary.com/aelredus.html,309,Neo-Latin,Aeneas Sylvius Piccolominus,piccolomini.txt,Index,Enea Silvio Piccolomini,http://thelatinlibrary.com/piccolomini.html,X300,Neo-Latin,Aeneas Sylvius Piccolominus,piccolomini.carmen.txt,Carmina Selecta,Enea Silvio Piccolomini,http://thelatinlibrary.com/piccolomini.carmen.html,308,Neo-Latin,Aeneas Sylvius Piccolominus,piccolomini.turcos.txt,Oratio contra Turcos,Enea Silvio Piccolomini,http://thelatinlibrary.com/piccolomini.turcos.html,5,Medieval,Auctor Incertus Vitae Sororis Agnetis,agnes.txt,Vita Sororis Agnetis,,http://thelatinlibrary.com/agnes.html,574,Medieval,Alanus de Insulis,alanus1.txt,Liber de plantcu naturae,Alan of Lille,http://thelatinlibrary.com/alanus/alanus1.html,575,Medieval,Alanus de Insulis,alanus2.txt,Anticlaudianus,Alan of Lille,http://thelatinlibrary.com/alanus/alanus2.html,576,Medieval,Albertanus Brixiensis,albertanus.arsloquendi.txt,Ars Loquendi Et Tacendi,Albertano da Brescia,http://thelatinlibrary.com/albertanus/albertanus.arsloquendi.shtml,577,Medieval,Albertanus Brixiensis,albertanus.liberconsol.txt,Liber Consolationis Et Consilii,Albertano da Brescia,http://thelatinlibrary.com/albertanus/albertanus.liberconsol.shtml,578,Medieval,Albertanus Brixiensis,albertanus.sermo.txt,Albertano Of Brescia,Albertano da Brescia,http://thelatinlibrary.com/albertanus/albertanus.sermo.shtml,579,Medieval,Albertanus Brixiensis,albertanus.sermo1.txt,Sermones I,Albertano da Brescia,http://thelatinlibrary.com/albertanus/albertanus.sermo1.shtml,580,Medieval,Albertanus Brixiensis,albertanus.sermo2.txt,Sermones Ii,Albertano da Brescia,http://thelatinlibrary.com/albertanus/albertanus.sermo2.shtml,581,Medieval,Albertanus Brixiensis,albertanus.sermo3.txt,Sermones Iii,Albertano da Brescia,http://thelatinlibrary.com/albertanus/albertanus.sermo3.shtml,582,Medieval,Albertanus Brixiensis,albertanus.sermo4.txt,Sermones Iv,Albertano da Brescia,http://thelatinlibrary.com/albertanus/albertanus.sermo4.shtml,583,Medieval,Albertanus Brixiensis,albertanus1.txt,De Amore Et Dilectione Dei Liber I,Albertano da Brescia,http://thelatinlibrary.com/albertanus/albertanus1.shtml,584,Medieval,Albertanus Brixiensis,albertanus2.txt,De Amore Et Dilectione Dei Liber Ii,Albertano da Brescia,http://thelatinlibrary.com/albertanus/albertanus2.shtml,585,Medieval,Albertanus Brixiensis,albertanus3.txt,De Amore Et Dilectione Dei Liber Iii,Albertano da Brescia,http://thelatinlibrary.com/albertanus/albertanus3.shtml,586,Medieval,Albertanus Brixiensis,albertanus4.txt,De Amore Et Dilectione Dei Liber Iv,Albertano da Brescia,http://thelatinlibrary.com/albertanus/albertanus4.shtml,587,Medieval,Albertus Aquensis,hist1.txt,Historia Hierosolymitanae expeditionis: Liber I,Albert of Aix-la-Chapelle/Albert of Aachen,http://thelatinlibrary.com/albertofaix/hist1.shtml,588,Medieval,Albertus Aquensis,hist10.txt,Historia Hierosolymitanae expeditionis: Liber X,Albert of Aix-la-Chapelle/Albert of Aachen,http://thelatinlibrary.com/albertofaix/hist10.shtml,589,Medieval,Albertus Aquensis,hist11.txt,Historia Hierosolymitanae expeditionis: Liber XI,Albert of Aix-la-Chapelle/Albert of Aachen,http://thelatinlibrary.com/albertofaix/hist11.shtml,590,Medieval,Albertus Aquensis,hist12.txt,Historia Hierosolymitanae expeditionis: Liber XII,Albert of Aix-la-Chapelle/Albert of Aachen,http://thelatinlibrary.com/albertofaix/hist12.shtml,591,Medieval,Albertus Aquensis,hist2.txt,Historia Hierosolymitanae expeditionis: Liber II,Albert of Aix-la-Chapelle/Albert of Aachen,http://thelatinlibrary.com/albertofaix/hist2.shtml,592,Medieval,Albertus Aquensis,hist3.txt,Historia Hierosolymitanae expeditionis: Liber III,Albert of Aix-la-Chapelle/Albert of Aachen,http://thelatinlibrary.com/albertofaix/hist3.shtml,593,Medieval,Albertus Aquensis,hist4.txt,Historia Hierosolymitanae expeditionis: Liber IV,Albert of Aix-la-Chapelle/Albert of Aachen,http://thelatinlibrary.com/albertofaix/hist4.shtml,594,Medieval,Albertus Aquensis,hist5.txt,Historia Hierosolymitanae expeditionis: Liber V,Albert of Aix-la-Chapelle/Albert of Aachen,http://thelatinlibrary.com/albertofaix/hist5.shtml,595,Medieval,Albertus Aquensis,hist6.txt,Historia Hierosolymitanae expeditionis: Liber VI,Albert of Aix-la-Chapelle/Albert of Aachen,http://thelatinlibrary.com/albertofaix/hist6.shtml,596,Medieval,Albertus Aquensis,hist7.txt,Historia Hierosolymitanae expeditionis: Liber VII,Albert of Aix-la-Chapelle/Albert of Aachen,http://thelatinlibrary.com/albertofaix/hist7.shtml,597,Medieval,Albertus Aquensis,hist8.txt,Historia Hierosolymitanae expeditionis: Liber VIII,Albert of Aix-la-Chapelle/Albert of Aachen,http://thelatinlibrary.com/albertofaix/hist8.shtml,598,Medieval,Albertus Aquensis,hist9.txt,Historia Hierosolymitanae expeditionis: Liber IX,Albert of Aix-la-Chapelle/Albert of Aachen,http://thelatinlibrary.com/albertofaix/hist9.shtml,468,Classical,Albius Tibullus,tibullus1.txt,Elegiae I,Tibullus,http://thelatinlibrary.com/tibullus1.html,469,Classical,Albius Tibullus,tibullus2.txt,Elegiae II,Tibullus,http://thelatinlibrary.com/tibullus2.html,470,Classical,Albius Tibullus,tibullus3.txt,Elegiae III,Tibullus,http://thelatinlibrary.com/tibullus3.html,599,Medieval,Alcuinus Turonensis,cella.txt,[fredugis]: Cella Alcuini,Alcuin,http://thelatinlibrary.com/alcuin/cella.shtml,600,Medieval,Alcuinus Turonensis,conflictus.txt,Conflictus Veris Et Hiemis,Alcuin,http://thelatinlibrary.com/alcuin/conflictus.shtml,601,Medieval,Alcuinus Turonensis,epitaphium.txt,Epitaphium,Alcuin,http://thelatinlibrary.com/alcuin/epitaphium.shtml,602,Medieval,Alcuinus Turonensis,luscinia.txt,De Luscinia,Alcuin,http://thelatinlibrary.com/alcuin/luscinia.shtml,603,Medieval,Alcuinus Turonensis,propos.txt,Propositiones,Alcuin,http://thelatinlibrary.com/alcuin/propos.shtml,604,Medieval,Alcuinus Turonensis,rec.txt,"Dilectissimo Aquilae Albinus MatriculariusPerpetuae Beatitudinis In Christo Salutem",Alcuin,http://thelatinlibrary.com/alcuin/rec.shtml,605,Medieval,Alcuinus Turonensis,rhetorica.txt,Disputatio De Rhetorica,Alcuin,http://thelatinlibrary.com/alcuin/rhetorica.shtml,606,Medieval,Alcuinus Turonensis,sequentia.txt,Sequentia De Sancto Michaele,Alcuin,http://thelatinlibrary.com/alcuin/sequentia.shtml,607,Medieval,Alcuinus Turonensis,versus.txt,Versus De Cuculo,Alcuin,http://thelatinlibrary.com/alcuin/versus.shtml,431,Neo-Latin,Alexander Smarius Crispus,smarius.txt,Carmina,Alexander Smarius Crispus,http://thelatinlibrary.com/smarius.html,608,Classical,Ambrosius Mediolanensis,epist.txt,Ad Sororem Marcellinam,"Saint Ambrose, Bishop of Milan",http://thelatinlibrary.com/ambrose/epist.html,609,Classical,Ambrosius Mediolanensis,epistvaria.txt,Epistulae Variae,"Saint Ambrose, Bishop of Milan",http://thelatinlibrary.com/ambrose/epistvaria.html,610,Classical,Ambrosius Mediolanensis,hymns.txt,Hymni,"Saint Ambrose, Bishop of Milan",http://thelatinlibrary.com/ambrose/hymns.html,611,Classical,Ambrosius Mediolanensis,mysteriis.txt,De Mysteriis,"Saint Ambrose, Bishop of Milan",http://thelatinlibrary.com/ambrose/mysteriis.html,612,Classical,Ammianus Marcellinus,14.txt,Res Gestae: Liber XIV,Ammianus Marcellinus,http://thelatinlibrary.com/ammianus/14.shtml,613,Classical,Ammianus Marcellinus,15.txt,Res Gestae: Liber XV,Ammianus Marcellinus,http://thelatinlibrary.com/ammianus/15.shtml,614,Classical,Ammianus Marcellinus,16.txt,Res Gestae: Liber XVI,Ammianus Marcellinus,http://thelatinlibrary.com/ammianus/16.shtml,615,Classical,Ammianus Marcellinus,17.txt,Res Gestae: Liber XVII,Ammianus Marcellinus,http://thelatinlibrary.com/ammianus/17.shtml,616,Classical,Ammianus Marcellinus,18.txt,Res Gestae: Liber XVIII,Ammianus Marcellinus,http://thelatinlibrary.com/ammianus/18.shtml,617,Classical,Ammianus Marcellinus,19.txt,Res Gestae: Liber XIX,Ammianus Marcellinus,http://thelatinlibrary.com/ammianus/19.shtml,618,Classical,Ammianus Marcellinus,20.txt,Res Gestae: Liber XX,Ammianus Marcellinus,http://thelatinlibrary.com/ammianus/20.shtml,619,Classical,Ammianus Marcellinus,21.txt,Res Gestae: Liber XXI,Ammianus Marcellinus,http://thelatinlibrary.com/ammianus/21.shtml,620,Classical,Ammianus Marcellinus,22.txt,Res Gestae: Liber XXII,Ammianus Marcellinus,http://thelatinlibrary.com/ammianus/22.shtml,621,Classical,Ammianus Marcellinus,23.txt,Res Gestae: Liber XXIII,Ammianus Marcellinus,http://thelatinlibrary.com/ammianus/23.shtml,622,Classical,Ammianus Marcellinus,24.txt,Res Gestae: Liber XXIV,Ammianus Marcellinus,http://thelatinlibrary.com/ammianus/24.shtml,623,Classical,Ammianus Marcellinus,25.txt,Res Gestae: Liber XXV,Ammianus Marcellinus,http://thelatinlibrary.com/ammianus/25.shtml,624,Classical,Ammianus Marcellinus,26.txt,Res Gestae: Liber XXVI,Ammianus Marcellinus,http://thelatinlibrary.com/ammianus/26.shtml,625,Classical,Ammianus Marcellinus,27.txt,Res Gestae: Liber XXVII,Ammianus Marcellinus,http://thelatinlibrary.com/ammianus/27.shtml,626,Classical,Ammianus Marcellinus,28.txt,Res Gestae: Liber XXVIII,Ammianus Marcellinus,http://thelatinlibrary.com/ammianus/28.shtml,627,Classical,Ammianus Marcellinus,29.txt,Res Gestae: Liber XXIX,Ammianus Marcellinus,http://thelatinlibrary.com/ammianus/29.shtml,628,Classical,Ammianus Marcellinus,30.txt,Res Gestae: Liber XXX,Ammianus Marcellinus,http://thelatinlibrary.com/ammianus/30.shtml,629,Classical,Ammianus Marcellinus,31.txt,Res Gestae: Liber XXXI,Ammianus Marcellinus,http://thelatinlibrary.com/ammianus/31.shtml,8,Medieval,Auctor Incertus Carminis de Andecavi Abbate,andecavis.txt,Andecavis Abbas,,http://thelatinlibrary.com/andecavis.html,9,Medieval,Andreas Bergomas,andreasbergoma.txt,Chronicon,Andrea da Bergamo,http://thelatinlibrary.com/andreasbergoma.html,973,Medieval,Andreas Capellanus,capellanus1.txt,de Amore Liber I,Andrew the Chaplain,http://thelatinlibrary.com/capellanus/capellanus1.html,974,Medieval,Andreas Capellanus,capellanus2.txt,de Amore Liber III,Andrew the Chaplain,http://thelatinlibrary.com/capellanus/capellanus2.html,975,Medieval,Andreas Capellanus,capellanus3.txt,de Amore Liber III,Andrew the Chaplain,http://thelatinlibrary.com/capellanus/capellanus3.html,248,Neo-Latin,Andreas Naugerius,navagero.txt,Lusus,Andrea Navagero,http://thelatinlibrary.com/navagero.html,11,Medieval,Angilbertus,angilbert.txt,Versus De Bella Quae Fuit Acta Fontaneto,"Angilbert, Abbot of Saint-Riquier",http://thelatinlibrary.com/angilbert.html,480,,Anonymus Valesianus,valesianus.txt,Index,,http://thelatinlibrary.com/valesianus.html,x481,,Anonymus Valesianus,valesianus1.txt,Origo Constantini Imperatoris,,http://thelatinlibrary.com/valesianus1.html,482,,Anonymus Valesianus,valesianus2.txt,Chronica Theodericiana,,http://thelatinlibrary.com/valesianus2.html,18,Medieval,Anselmus Cantuariensis,anselmproslogion.txt,Proslogion,Saint Anselm of Canterbury,http://thelatinlibrary.com/anselmproslogion.html,17,Medieval,Anselmus Cantuariensis,anselmepistula.txt,Epistula ad Urbanum Papam,Saint Anselm of Canterbury,http://thelatinlibrary.com/anselmepistula.html,630,Classical,Apicius,apicius1.txt,de Re Coquinaria Liber I,Apicius,http://thelatinlibrary.com/apicius/apicius1.shtml,631,Classical,Apicius,apicius2.txt,de Re Coquinaria Liber II,Apicius,http://thelatinlibrary.com/apicius/apicius2.shtml,632,Classical,Apicius,apicius3.txt,de Re Coquinaria Liber III,Apicius,http://thelatinlibrary.com/apicius/apicius3.shtml,633,Classical,Apicius,apicius4.txt,Re Coquinaria Liber IV,Apicius,http://thelatinlibrary.com/apicius/apicius4.shtml,634,Classical,Apicius,apicius5.txt,de Re Coquinaria Liber V,Apicius,http://thelatinlibrary.com/apicius/apicius5.shtml,19,Classical,Appendix Vergiliana,appverg.aetna.txt,Aetna,Appendix Vergiliana,http://thelatinlibrary.com/appverg.aetna.html,20,Classical,Appendix Vergiliana,appverg.catalepton.txt,Catalepton,Appendix Vergiliana,http://thelatinlibrary.com/appverg.catalepton.html,21,Classical,Appendix Vergiliana,appverg.ciris.txt,Ciris,Appendix Vergiliana,http://thelatinlibrary.com/appverg.ciris.html,22,Classical,Appendix Vergiliana,appvergcomp.txt,Appendix Vergiliana,Appendix Vergiliana,http://thelatinlibrary.com/appvergcomp.html,23,Classical,Appendix Vergiliana,appvergculex.txt,Culex,Appendix Vergiliana,http://thelatinlibrary.com/appvergculex.html,25,Medieval,Archipoeta,archpoet.txt,Carmina,Archpoet,http://thelatinlibrary.com/archpoet.html,740,Classical,Arnobius,arnobius1.txt,Adversus Nationes Liber I,Arnobius,http://thelatinlibrary.com/arnobius/arnobius1.shtml,741,Classical,Arnobius,arnobius2.txt,Adversus Nationes Liber II,Arnobius,http://thelatinlibrary.com/arnobius/arnobius2.shtml,742,Classical,Arnobius,arnobius3.txt,Adversus Nationes Liber III,Arnobius,http://thelatinlibrary.com/arnobius/arnobius3.shtml,743,Classical,Arnobius,arnobius4.txt,Adversus Nationes Liber IV,Arnobius,http://thelatinlibrary.com/arnobius/arnobius4.shtml,744,Classical,Arnobius,arnobius5.txt,Adversus Nationes Liber V,Arnobius,http://thelatinlibrary.com/arnobius/arnobius5.shtml,745,Classical,Arnobius,arnobius6.txt,Adversus Nationes Liber VI,Arnobius,http://thelatinlibrary.com/arnobius/arnobius6.shtml,746,Classical,Arnobius,arnobius7.txt,Adversus Nationes Liber VII,Arnobius,http://thelatinlibrary.com/arnobius/arnobius7.shtml,26,Medieval,Arnulf,arnulf.txt,Arnulf of Lisieux: De Nativitate Domini,Arnulf of Lisieux,http://thelatinlibrary.com/arnulf.html,373,Neo-Latin,Arthurus Rimbaud,rimbaud.txt,VER ERAT,Arthur Rimbaud,http://thelatinlibrary.com/rimbaud.html,27,Classical,Asconius Pedianus,asconius.txt,ORATIONUM CICERONIS QUINQUE ENARRATIO,Asconius,http://thelatinlibrary.com/asconius.html,28,Medieval,Asserius,asserius.txt,DE REBUS GESTIS AELFREDI,Asser,http://thelatinlibrary.com/asserius.html,186,Medieval,Auctor Incertus,inquisitio.txt,"AN ELEVENTH-CENTURY INQUISITION OF ST. AUGUSTINE'S, CANTERBURY",,http://thelatinlibrary.com/inquisitio.html,24,Medieval,Auctor Incertus [Bernard of Kilwinning],arbroath.txt,Declaratio Arbroathis,,http://thelatinlibrary.com/arbroath.html,559,Medieval,Auctor Incertus Annalium Xantensium,xanten.txt,ANNALES XANTENSES QUI DICUNTUR,,http://thelatinlibrary.com/xanten.html,12,Medieval,Auctor Incertus Annalum Regni Francorum,annalesregnifrancorum.txt,Annales Regni Francorum,,http://thelatinlibrary.com/annalesregnifrancorum.html,13,Medieval,Auctor Incertus Annalum Vedastinorum,annalesvedastini.txt,Annales Vedastini,,http://thelatinlibrary.com/annalesvedastini.html,50,Medieval,Auctor Incertus Brevis Chronici Northmannici,brevechronicon.txt,Breve Chronicon Northmannicum,,http://thelatinlibrary.com/brevechronicon.shtml,56,Classical,Auctor Incertus Carminis Arvalis,carmenarvale.txt,Carmen Arvale,,http://thelatinlibrary.com/carmenarvale.html,15,Medieval,Auctor Incertus Carminis de Martyrio Maccabaeorum,anon.martyrio.txt,Carmen de Martyrio Maccabaeorum,,http://thelatinlibrary.com/anon.martyrio.html,57,Medieval,Auctor Incertus Carminis in Victoriam Pisanorum,carmeninvictoriam.txt,CARMEN IN VICTORIAM PISANORUM,,http://thelatinlibrary.com/carmeninvictoriam.html,58,Classical,Auctor Incertus Carminis Saliaris,carmensaliare.txt,Carmen Saliare,,http://thelatinlibrary.com/carmensaliare.html,55,Medieval,Auctor Incertus Carminum Buranorum,carm.bur.txt,Carmina Burana,,http://thelatinlibrary.com/carm.bur.html,14,Medieval,Auctor Incertus De Ramis Cadunt Folia,anon.deramis.txt,De Ramis Cadunt Folia,,http://thelatinlibrary.com/anon.deramis.html,60,Classical,Auctor Incertus Distichorum Catonis,cato.dis.txt,Disticha Catonis,,http://thelatinlibrary.com/cato.dis.html,118,Medieval,Auctor Incertus Foederis Aeterni Fratrum,foedusaeternum.txt,Foedus Aeternum Fratrum,,http://thelatinlibrary.com/foedusaeternum.html,133,Medieval,Auctor Incertus Gaudeamus Igitur,gaud.txt,Gaudeamus Igitur,,http://thelatinlibrary.com/gaud.html,1229,Medieval,Auctor Incertus Gestorum Francorum,gestafrancorum1.txt,Gesta Francorum I,,http://thelatinlibrary.com/gestafrancorum/gestafrancorum1.shtml,1230,Medieval,Auctor Incertus Gestorum Francorum,gestafrancorum10.txt,Gesta Francorum X,,http://thelatinlibrary.com/gestafrancorum/gestafrancorum10.shtml,1231,Medieval,Auctor Incertus Gestorum Francorum,gestafrancorum2.txt,Gesta Francorum II,,http://thelatinlibrary.com/gestafrancorum/gestafrancorum2.shtml,1232,Medieval,Auctor Incertus Gestorum Francorum,gestafrancorum3.txt,Gesta Francorum III,,http://thelatinlibrary.com/gestafrancorum/gestafrancorum3.shtml,1233,Medieval,Auctor Incertus Gestorum Francorum,gestafrancorum4.txt,Gesta Francorum IIII,,http://thelatinlibrary.com/gestafrancorum/gestafrancorum4.shtml,1234,Medieval,Auctor Incertus Gestorum Francorum,gestafrancorum5.txt,Gesta Francorum V,,http://thelatinlibrary.com/gestafrancorum/gestafrancorum5.shtml,1235,Medieval,Auctor Incertus Gestorum Francorum,gestafrancorum6.txt,Gesta Francorum VI,,http://thelatinlibrary.com/gestafrancorum/gestafrancorum6.shtml,1236,Medieval,Auctor Incertus Gestorum Francorum,gestafrancorum7.txt,Gesta Francorum VII,,http://thelatinlibrary.com/gestafrancorum/gestafrancorum7.shtml,1237,Medieval,Auctor Incertus Gestorum Francorum,gestafrancorum8.txt,Gesta Francorum VIII,,http://thelatinlibrary.com/gestafrancorum/gestafrancorum8.shtml,1238,Medieval,Auctor Incertus Gestorum Francorum,gestafrancorum9.txt,Gesta Francorum IX,,http://thelatinlibrary.com/gestafrancorum/gestafrancorum9.shtml,136,Medieval,Auctor Incertus Gestorum Romanorum,gestarom.txt,Gesta Romanorum,,http://thelatinlibrary.com/gestarom.shtml,161,Medieval,MISCELLANEA CARMINVM MEDIAE AETATIS,hebet.txt,Hebet Sidus Leti Visus,,http://thelatinlibrary.com/hebet.html,168,Medieval,Auctor Incertus Historiae Apollonii regis Tyri,histapoll.txt,Historia Apollonii regis Tyri,,http://thelatinlibrary.com/histapoll.html,169,Medieval,Auctor Incertus Historiae Brittonum,histbrit.txt,Historia Brittonum,,http://thelatinlibrary.com/histbrit.html,416,Medieval,Auctor Incertus Historiae Septem Sapiuntium,septsap.txt,Historia Septem Sapientium,Scriptores Historiae Augustae,http://thelatinlibrary.com/septsap.html,177,Medieval,Auctor Incertus Hymnorum et Canticorum,hymni.txt,HYMNI ET CANTICA,,http://thelatinlibrary.com/hymni.html,180,Classical,Auctor Incertus Iliadis Latinae,ilias.txt,Ilias Latina,,http://thelatinlibrary.com/ilias.html,204,Medieval,Auctor Incertus Legendae Maioris Sancti Regis Stephani,legenda.stephani.txt,Legenda Maior Sancti Regis Stephani,,http://thelatinlibrary.com/legenda.stephani.html,198,Medieval,Auctor Incertus Libri Kalilae et Dimnae,kalila.txt,Liber Kalilae et Dimnae,,http://thelatinlibrary.com/kalila.html,221,Medieval,Auctor Incertus Magnae Cartae,magnacarta.txt,Magna Carta,,http://thelatinlibrary.com/magnacarta.html,242,Medieval,Auctor Incertus Mirabiliorum Urbis Romae,mirabilia.txt,Mirabilia Urbis Romae,Giovanni Pico della Mirandola,http://thelatinlibrary.com/mirabilia.html,243,Medieval,Auctor Incertus Mirabiliorum Urbis Romae,mirabilia1.txt,MAGISTRI GREGORII NARRATIO DE MIRABILIBUS URBIS ROMAE,Giovanni Pico della Mirandola,http://thelatinlibrary.com/mirabilia1.html,263,Medieval,Auctor Incertus Notitiarum Dignitatum,notitia1.txt,NOTITIA DIGNITATUM IN PARTIBUS OCCIDENTIS,,http://thelatinlibrary.com/notitia1.html,264,Medieval,Auctor Incertus Notitiarum Dignitatum,notitia2.txt,NOTITIA DIGNITATUM IN PARTIBUS ORIENTIS,,http://thelatinlibrary.com/notitia2.html,270,Medieval,Auctor Incertus Originis gentis Langobardorum,origo.txt,Origo gentis Langobardorum,,http://thelatinlibrary.com/origo.html,283,Medieval,Auctor Incertus Passionis Sanctarum Perpetuae et Felicitatis,perp.txt,PASSIO SANCTARUM PERPETUAE ET FELICITATIS,,http://thelatinlibrary.com/perp.html,285,Classical,Auctor Incertus Pervigilii Veneris,pervig.txt,Pervigilium Veneris,Pervigilium Veneris,http://thelatinlibrary.com/pervig.html,310,Medieval,Auctor Incertus Plancti DESTRUCTIONIS REGNI HUNGARIAE PER TARTAROS,planctus.txt,PLANCTUS DESTRUCTIONIS REGNI HUNGARIAE PER TARTAROS,,http://thelatinlibrary.com/planctus.html,337,Medieval,Auctor Incertus Precationis Terrae,prec.terr.txt,Precatio Terrae,,http://thelatinlibrary.com/prec.terr.html,340,Medieval,Auctor Incertus Professionis contra Sectam Priscilliani,professio.txt,Professio contra Sectam Priscilliani,,http://thelatinlibrary.com/professio.html,461,Medieval,Auctor Incertus Testamenti Porcelli,testamentum.txt,Testamentum Porcelli,,http://thelatinlibrary.com/testamentum.html,533,Medieval,Auctor Incertus Waltharii,waltarius1.txt,Waltharius I,,http://thelatinlibrary.com/waltarius1.html,534,Medieval,Auctor Incertus Waltharii,waltarius2.txt,Waltharius II,,http://thelatinlibrary.com/waltarius2.html,535,Medieval,Auctor Incertus Waltharii,waltarius3.txt,Waltharius III,,http://thelatinlibrary.com/waltarius3.html,187,Classical,Auctores Incerti,inscriptions.txt,INSCRIPTIONES PARIETARIAE,,http://thelatinlibrary.com/inscriptions.html,747,Classical,Augustinus Hipponensis,catechizandis.txt,de Catechizandis Rudibus,"Saint Augustine, Bishop of Hippo",http://thelatinlibrary.com/augustine/catechizandis.shtml,748,Classical,Augustinus Hipponensis,civ1.txt,De Civitate Dei Liber I,"Saint Augustine, Bishop of Hippo",http://thelatinlibrary.com/augustine/civ1.shtml,749,Classical,Augustinus Hipponensis,civ10.txt,De Civitate Dei Liber X,"Saint Augustine, Bishop of Hippo",http://thelatinlibrary.com/augustine/civ10.shtml,750,Classical,Augustinus Hipponensis,civ11.txt,De Civitate Dei Liber XI,"Saint Augustine, Bishop of Hippo",http://thelatinlibrary.com/augustine/civ11.shtml,751,Classical,Augustinus Hipponensis,civ12.txt,De Civitate Dei Liber XII,"Saint Augustine, Bishop of Hippo",http://thelatinlibrary.com/augustine/civ12.shtml,752,Classical,Augustinus Hipponensis,civ13.txt,De Civitate Dei Liber XIII,"Saint Augustine, Bishop of Hippo",http://thelatinlibrary.com/augustine/civ13.shtml,753,Classical,Augustinus Hipponensis,civ14.txt,De Civitate Dei Liber XIV,"Saint Augustine, Bishop of Hippo",http://thelatinlibrary.com/augustine/civ14.shtml,754,Classical,Augustinus Hipponensis,civ15.txt,De Civitate Dei Liber XV,"Saint Augustine, Bishop of Hippo",http://thelatinlibrary.com/augustine/civ15.shtml,755,Classical,Augustinus Hipponensis,civ16.txt,De Civitate Dei Liber XVI,"Saint Augustine, Bishop of Hippo",http://thelatinlibrary.com/augustine/civ16.shtml,756,Classical,Augustinus Hipponensis,civ17.txt,De Civitate Dei Liber XVII,"Saint Augustine, Bishop of Hippo",http://thelatinlibrary.com/augustine/civ17.shtml,757,Classical,Augustinus Hipponensis,civ18.txt,De Civitate Dei Liber XVIII,"Saint Augustine, Bishop of Hippo",http://thelatinlibrary.com/augustine/civ18.shtml,758,Classical,Augustinus Hipponensis,civ19.txt,De Civitate Dei Liber XIX,"Saint Augustine, Bishop of Hippo",http://thelatinlibrary.com/augustine/civ19.shtml,759,Classical,Augustinus Hipponensis,civ2.txt,De Civitate Dei Liber II,"Saint Augustine, Bishop of Hippo",http://thelatinlibrary.com/augustine/civ2.shtml,760,Classical,Augustinus Hipponensis,civ20.txt,De Civitate Dei Liber XX,"Saint Augustine, Bishop of Hippo",http://thelatinlibrary.com/augustine/civ20.shtml,761,Classical,Augustinus Hipponensis,civ21.txt,De Civitate Dei Liber XXI,"Saint Augustine, Bishop of Hippo",http://thelatinlibrary.com/augustine/civ21.shtml,762,Classical,Augustinus Hipponensis,civ22.txt,De Civitate Dei Liber XXII,"Saint Augustine, Bishop of Hippo",http://thelatinlibrary.com/augustine/civ22.shtml,763,Classical,Augustinus Hipponensis,civ3.txt,De Civitate Dei Liber III,"Saint Augustine, Bishop of Hippo",http://thelatinlibrary.com/augustine/civ3.shtml,764,Classical,Augustinus Hipponensis,civ4.txt,De Civitate Dei Liber IV,"Saint Augustine, Bishop of Hippo",http://thelatinlibrary.com/augustine/civ4.shtml,765,Classical,Augustinus Hipponensis,civ5.txt,De Civitate Dei Liber V,"Saint Augustine, Bishop of Hippo",http://thelatinlibrary.com/augustine/civ5.shtml,766,Classical,Augustinus Hipponensis,civ6.txt,De Civitate Dei Liber VI,"Saint Augustine, Bishop of Hippo",http://thelatinlibrary.com/augustine/civ6.shtml,767,Classical,Augustinus Hipponensis,civ7.txt,De Civitate Dei Liber VII,"Saint Augustine, Bishop of Hippo",http://thelatinlibrary.com/augustine/civ7.shtml,768,Classical,Augustinus Hipponensis,civ8.txt,De Civitate Dei Liber VIII,"Saint Augustine, Bishop of Hippo",http://thelatinlibrary.com/augustine/civ8.shtml,769,Classical,Augustinus Hipponensis,civ9.txt,De Civitate Dei Liber IX,"Saint Augustine, Bishop of Hippo",http://thelatinlibrary.com/augustine/civ9.shtml,770,Classical,Augustinus Hipponensis,conf1.txt,Confessiones I,"Saint Augustine, Bishop of Hippo",http://thelatinlibrary.com/augustine/conf1.shtml,771,Classical,Augustinus Hipponensis,conf10.txt,Confessiones X,"Saint Augustine, Bishop of Hippo",http://thelatinlibrary.com/augustine/conf10.shtml,